{"$id":"https://awesome-self-skills.local/schemas/v5-clarification-control-registry.schema.json","$schema":"https://json-schema.org/draft/2020-12/schema","additionalProperties":false,"properties":{"clone_marker_tokens":{"items":false,"maxItems":2,"minItems":2,"prefixItems":[{"const":"同一回答适用于"},{"const":"以下回答同时适用"}],"type":"array"},"confirmation_tokens":{"items":false,"maxItems":2,"minItems":2,"prefixItems":[{"const":"确认提交"},{"const":"确认以上变更"}],"type":"array"},"control_tokens":{"additionalProperties":false,"properties":{"close_for_delivery":{"items":false,"maxItems":2,"minItems":2,"prefixItems":[{"const":"关闭该问题并继续交付"},{"const":"保留未解决并继续交付"}],"type":"array"},"defer":{"items":false,"maxItems":2,"minItems":2,"prefixItems":[{"const":"暂缓回答"},{"const":"稍后回答"}],"type":"array"},"unknown":{"items":false,"maxItems":2,"minItems":2,"prefixItems":[{"const":"目前未知"},{"const":"暂不清楚"}],"type":"array"}},"required":["defer","unknown","close_for_delivery"],"type":"object"},"control_wrapper_punctuation":{"items":false,"maxItems":21,"minItems":21,"prefixItems":[{"const":":"},{"const":"："},{"const":","},{"const":"，"},{"const":";"},{"const":"；"},{"const":"."},{"const":"。"},{"const":"!"},{"const":"！"},{"const":"?"},{"const":"？"},{"const":"、"},{"const":"("},{"const":")"},{"const":"（"},{"const":"）"},{"const":"["},{"const":"]"},{"const":"【"},{"const":"】"}],"type":"array"},"registry_digest":{"const":"sha256:eb88ec21cb864b2f7508855132964a32458841b6e4e36d31debdc6d521d2948c"},"registry_version":{"const":1},"temporary_marker_tokens":{"items":false,"maxItems":2,"minItems":2,"prefixItems":[{"const":"临时按此口径"},{"const":"暂按此口径"}],"type":"array"}},"required":["registry_version","confirmation_tokens","temporary_marker_tokens","clone_marker_tokens","control_wrapper_punctuation","control_tokens","registry_digest"],"type":"object"}
