{"clone_marker_tokens":["同一回答适用于","以下回答同时适用"],"confirmation_tokens":["确认提交","确认以上变更"],"control_tokens":{"close_for_delivery":["关闭该问题并继续交付","保留未解决并继续交付"],"defer":["暂缓回答","稍后回答"],"unknown":["目前未知","暂不清楚"]},"control_wrapper_punctuation":[":","：",",","，",";","；",".","。","!","！","?","？","、","(",")","（","）","[","]","【","】"],"registry_digest":"sha256:eb88ec21cb864b2f7508855132964a32458841b6e4e36d31debdc6d521d2948c","registry_version":1,"temporary_marker_tokens":["临时按此口径","暂按此口径"]}
